{"schema_version":1,"event_id":"00000000-0000-4000-8000-000000000001","run_id":"00000000-0000-4000-8000-000000000002","event_type":"run_completed","occurred_at":"2026-07-24T10:00:00.123456Z","principal_id":"00000000-0000-4000-8000-000000000003","auth_method":"oidc","oidc_issuer_hash":"0707070707070707070707070707070707070707070707070707070707070707","policy_version_hash":"0101010101010101010101010101010101010101010101010101010101010101","decision":"allow","decision_reason_codes":["policy_allowed","region_allowed"],"requested_model":"local-legal","resolved_backend":"local-backend","content_hmac_key_id":"content-key-v1","request_hmac":"0202020202020202020202020202020202020202020202020202020202020202","response_hmac":"0606060606060606060606060606060606060606060606060606060606060606","request_bytes":128,"response_bytes":256,"pii_categories":["email_address","tax_id"],"pii_match_counts":{"email_address":2,"tax_id":1},"health_indicator_categories":["diagnosis_indicator","medication_indicator"],"secret_categories":["api_credential","private_key"],"detector_bundle_hash":"0303030303030303030303030303030303030303030303030303030303030303","input_tokens":12,"output_tokens":8,"reserved_cost_micros":300,"actual_cost_micros":220,"status":"completed","error_code":null,"previous_event_hash":"0404040404040404040404040404040404040404040404040404040404040404","software_version":"v0.1.0","config_hash":"0505050505050505050505050505050505050505050505050505050505050505"}
